{
  "$schema": "https://json-schema.org/draft/2020-12/schema",
  "type": "array",
  "items": {
    "type": "object",
    "required": ["labels"],
    "additionalProperties": false,
    "properties": {
      "labels": {"type": "object", "additionalProperties": {"type": "string"}},
      "annotations": {"type": "object", "additionalProperties": {"type": "string"}},
      "startsAt": {"type": "string", "format": "date-time"},
      "endsAt": {"type": "string", "format": "date-time"},
      "generatorURL": {"type": "string"}
    }
  }
}
