[
  {
    "labels": {"alertname": "FirewallPositiveControl", "instance": "integration-test"},
    "annotations": {"summary": "Firewall positive control"},
    "startsAt": "2026-09-03T12:00:00Z",
    "endsAt": "2099-09-03T12:10:00Z",
    "generatorURL": "http://integration-test.local/firewall"
  }
]
